<?xml version="1.0" encoding="iso-8859-1"?>
<Bussimulation xmlns:xsi="http://www.w3.org/2001/XMLSchema-instance" xsi:noNamespaceSchemaLocation="D:\OR-Methoden\Eisenstadt\xmlFiles\xsd\busSimulation.xsd">
  <Strassennetz>
    <Haltestellen>
      <Haltestelle id="1">
        <Name>Haltestelle 2</Name>
        <Kapazitaet>1</Kapazitaet>
        <Point xValue="448" yValue="279" />
      </Haltestelle>
      <Haltestelle id="2">
        <Name>Haltestelle 6</Name>
        <Kapazitaet>1</Kapazitaet>
        <Point xValue="409" yValue="318" />
      </Haltestelle>
      <Haltestelle id="3">
        <Name>Haltestelle 4</Name>
        <Kapazitaet>1</Kapazitaet>
        <Point xValue="123" yValue="344" />
      </Haltestelle>
      <Haltestelle id="4">
        <Name>Haltestelle 5</Name>
        <Kapazitaet>1</Kapazitaet>
        <Point xValue="305" yValue="292" />
      </Haltestelle>
      <Haltestelle id="5">
        <Name>Haltestelle 7</Name>
        <Kapazitaet>1</Kapazitaet>
        <Point xValue="383" yValue="487" />
      </Haltestelle>
      <Haltestelle id="6">
        <Name>Haltestelle 1</Name>
        <Kapazitaet>1</Kapazitaet>
        <Point xValue="396" yValue="422" />
      </Haltestelle>
      <Haltestelle id="7">
        <Name>Haltestelle 3</Name>
        <Kapazitaet>1</Kapazitaet>
        <Point xValue="253" yValue="292" />
      </Haltestelle>
    </Haltestellen>
    <Planquadrate>
      <PlanquadratStrasse id="11">
        <Strasse id="11" art="isStreet">
          <GesamtKosten>0</GesamtKosten>
          <KostenStartBisPunkt>0</KostenStartBisPunkt>
          <KostenPunktBisZiel>0</KostenPunktBisZiel>
          <Point xStart="169" yStart="325" xEnd="286" yEnd="299" />
          <Feldgroesse width="13.0" height="13.0" />
        </Strasse>
      </PlanquadratStrasse>
      <PlanquadratStrasse id="12">
        <Strasse id="12" art="isStreet">
          <GesamtKosten>0</GesamtKosten>
          <KostenStartBisPunkt>0</KostenStartBisPunkt>
          <KostenPunktBisZiel>0</KostenPunktBisZiel>
          <Point xStart="130" yStart="351" xEnd="169" yEnd="325" />
          <Feldgroesse width="13.0" height="13.0" />
        </Strasse>
      </PlanquadratStrasse>
      <PlanquadratStrasse id="13">
        <Strasse id="13" art="isStreet">
          <GesamtKosten>0</GesamtKosten>
          <KostenStartBisPunkt>0</KostenStartBisPunkt>
          <KostenPunktBisZiel>0</KostenPunktBisZiel>
          <Point xStart="416" yStart="325" xEnd="429" yEnd="299" />
          <Feldgroesse width="13.0" height="13.0" />
        </Strasse>
      </PlanquadratStrasse>
      <PlanquadratStrasse id="0">
        <Strasse id="0" art="isStreet">
          <GesamtKosten>0</GesamtKosten>
          <KostenStartBisPunkt>0</KostenStartBisPunkt>
          <KostenPunktBisZiel>0</KostenPunktBisZiel>
          <Point xStart="455" yStart="507" xEnd="468" yEnd="546" />
          <Feldgroesse width="13.0" height="13.0" />
        </Strasse>
      </PlanquadratStrasse>
      <PlanquadratStrasse id="1">
        <Strasse id="1" art="isStreet">
          <GesamtKosten>0</GesamtKosten>
          <KostenStartBisPunkt>0</KostenStartBisPunkt>
          <KostenPunktBisZiel>0</KostenPunktBisZiel>
          <Point xStart="286" yStart="299" xEnd="325" yEnd="312" />
          <Feldgroesse width="13.0" height="13.0" />
        </Strasse>
      </PlanquadratStrasse>
      <PlanquadratStrasse id="2">
        <Strasse id="2" art="isStreet">
          <GesamtKosten>0</GesamtKosten>
          <KostenStartBisPunkt>0</KostenStartBisPunkt>
          <KostenPunktBisZiel>0</KostenPunktBisZiel>
          <Point xStart="39" yStart="416" xEnd="130" yEnd="351" />
          <Feldgroesse width="13.0" height="13.0" />
        </Strasse>
      </PlanquadratStrasse>
      <PlanquadratStrasse id="3">
        <Strasse id="3" art="isStreet">
          <GesamtKosten>0</GesamtKosten>
          <KostenStartBisPunkt>0</KostenStartBisPunkt>
          <KostenPunktBisZiel>0</KostenPunktBisZiel>
          <Point xStart="416" yStart="442" xEnd="455" yEnd="507" />
          <Feldgroesse width="13.0" height="13.0" />
        </Strasse>
      </PlanquadratStrasse>
      <PlanquadratStrasse id="4">
        <Strasse id="4" art="isStreet">
          <GesamtKosten>0</GesamtKosten>
          <KostenStartBisPunkt>0</KostenStartBisPunkt>
          <KostenPunktBisZiel>0</KostenPunktBisZiel>
          <Point xStart="494" yStart="273" xEnd="546" yEnd="273" />
          <Feldgroesse width="13.0" height="13.0" />
        </Strasse>
      </PlanquadratStrasse>
      <PlanquadratStrasse id="5">
        <Strasse id="5" art="isStreet">
          <GesamtKosten>0</GesamtKosten>
          <KostenStartBisPunkt>0</KostenStartBisPunkt>
          <KostenPunktBisZiel>0</KostenPunktBisZiel>
          <Point xStart="468" yStart="546" xEnd="481" yEnd="598" />
          <Feldgroesse width="13.0" height="13.0" />
        </Strasse>
      </PlanquadratStrasse>
      <PlanquadratStrasse id="6">
        <Strasse id="6" art="isStreet">
          <GesamtKosten>0</GesamtKosten>
          <KostenStartBisPunkt>0</KostenStartBisPunkt>
          <KostenPunktBisZiel>0</KostenPunktBisZiel>
          <Point xStart="416" yStart="364" xEnd="416" yEnd="325" />
          <Feldgroesse width="13.0" height="13.0" />
        </Strasse>
      </PlanquadratStrasse>
      <PlanquadratStrasse id="7">
        <Strasse id="7" art="isStreet">
          <GesamtKosten>0</GesamtKosten>
          <KostenStartBisPunkt>0</KostenStartBisPunkt>
          <KostenPunktBisZiel>0</KostenPunktBisZiel>
          <Point xStart="325" yStart="312" xEnd="416" yEnd="442" />
          <Feldgroesse width="13.0" height="13.0" />
        </Strasse>
      </PlanquadratStrasse>
      <PlanquadratStrasse id="8">
        <Strasse id="8" art="isStreet">
          <GesamtKosten>0</GesamtKosten>
          <KostenStartBisPunkt>0</KostenStartBisPunkt>
          <KostenPunktBisZiel>0</KostenPunktBisZiel>
          <Point xStart="377" yStart="585" xEnd="416" yEnd="364" />
          <Feldgroesse width="13.0" height="13.0" />
        </Strasse>
      </PlanquadratStrasse>
      <PlanquadratStrasse id="9">
        <Strasse id="9" art="isStreet">
          <GesamtKosten>0</GesamtKosten>
          <KostenStartBisPunkt>0</KostenStartBisPunkt>
          <KostenPunktBisZiel>0</KostenPunktBisZiel>
          <Point xStart="429" yStart="299" xEnd="494" yEnd="273" />
          <Feldgroesse width="13.0" height="13.0" />
        </Strasse>
      </PlanquadratStrasse>
      <PlanquadratStrasse id="10">
        <Strasse id="10" art="isStreet">
          <GesamtKosten>0</GesamtKosten>
          <KostenStartBisPunkt>0</KostenStartBisPunkt>
          <KostenPunktBisZiel>0</KostenPunktBisZiel>
          <Point xStart="546" yStart="273" xEnd="611" yEnd="286" />
          <Feldgroesse width="13.0" height="13.0" />
        </Strasse>
      </PlanquadratStrasse>
    </Planquadrate>
    <Ziele>
      <Ziel id="0">
        <Name>Ziel [9, 29]</Name>
        <Point xValue="123" yValue="383" />
      </Ziel>
      <Ziel id="1">
        <Name>Ziel [18, 21]</Name>
        <Point xValue="240" yValue="279" />
      </Ziel>
      <Ziel id="2">
        <Name>Ziel [25, 27]</Name>
        <Point xValue="331" yValue="357" />
      </Ziel>
      <Ziel id="3">
        <Name>Ziel [29, 32]</Name>
        <Point xValue="383" yValue="422" />
      </Ziel>
      <Ziel id="4">
        <Name>Ziel [33, 21]</Name>
        <Point xValue="435" yValue="279" />
      </Ziel>
      <Ziel id="5">
        <Name>Ziel [43, 19]</Name>
        <Point xValue="565" yValue="253" />
      </Ziel>
      <Ziel id="6">
        <Name>Ziel [31, 39]</Name>
        <Point xValue="409" yValue="513" />
      </Ziel>
      <Ziel id="7">
        <Name>Ziel [38, 28]</Name>
        <Point xValue="500" yValue="370" />
      </Ziel>
      <Ziel id="8">
        <Name>Ziel [46, 28]</Name>
        <Point xValue="604" yValue="370" />
      </Ziel>
      <Ziel id="9">
        <Name>Ziel [40, 33]</Name>
        <Point xValue="526" yValue="435" />
      </Ziel>
    </Ziele>
  </Strassennetz>
  <SimuKonfiguration>
    <AktuelleAufloesung resWidth="1024" resHeight="768" />
    <GroessePlanquadrat>13</GroessePlanquadrat>
    <EinstellungenFrame width="330" height="400" />
    <GroesseFeldelement>65.0</GroesseFeldelement>
    <BusGeschwindigkeit>40.0</BusGeschwindigkeit>
    <GehGeschwindigkeit>6.0</GehGeschwindigkeit>
  </SimuKonfiguration>
  <SimuPanel>
    <GroesseEditor>640</GroesseEditor>
    <GroesseFelder>13</GroesseFelder>
    <AnzahlFelder>49</AnzahlFelder>
    <BackgroundImage url="/D:/OR-Methoden/Eisenstadt/bin/Eisenstadt.jpg" width="840" height="840" />
    <Haltestellen>
      <Haltestelle id="5" />
      <Haltestelle id="3" />
      <Haltestelle id="2" />
      <Haltestelle id="7" />
      <Haltestelle id="1" />
      <Haltestelle id="4" />
      <Haltestelle id="6" />
    </Haltestellen>
    <BusPanels />
    <BenoetigteBusse />
  </SimuPanel>
  <VirtualGrid>-- gets Data from SimuKonfiguration --</VirtualGrid>
</Bussimulation>

